URL,Version,Status,OIDs,Name,Title,Description,Used
http://snomed.info/sct,null,active,"2.16.840.1.113883.6.96",SNOMED_CT,SNOMED CT (all versions),"SNOMED CT is the most comprehensive and precise clinical health terminology product in the world, owned and distributed around the world by The International Health Terminology Standards Development Organisation (IHTSDO).","ValueSet/mindfulness-qualifier-vs,ConceptMap/MindfulnessDiagnosticMap,ValueSet/mood-vs,ValueSet/measurement-device-type-vs,ValueSet/measurement-context-vs,ValueSet/measurement-context-vital-signs,ValueSet/measurement-conditions-vs,ValueSet/physical-activity-type-vs,ValueSet/mindfulness-outcome-vs,ValueSet/sleep-quality-extended-vs,ValueSet/measurement-quality-vs,ValueSet/sleep-quality-vs"
https://github.com/RicardoLSantos/shorthand/CodeSystem/environment-type-cs,0.1.0,draft,,EnvironmentTypeCS,Practice Environment Types,"Types of environments for mindfulness practice","ValueSet/environment-type-vs"
https://github.com/RicardoLSantos/shorthand/CodeSystem/mindfulness-outcome-cs,0.1.0,draft,,MindfulnessOutcomeCS,Mindfulness Outcomes,"Outcomes and effects of mindfulness practice","ValueSet/mindfulness-outcome-vs"
https://github.com/RicardoLSantos/shorthand/CodeSystem/mindfulness-qualifier-cs,0.1.0,draft,,MindfulnessQualifierCS,Mindfulness Practice Qualifiers,"Qualifiers for mindfulness practice characteristics","ValueSet/mindfulness-qualifier-vs"
https://github.com/RicardoLSantos/shorthand/CodeSystem/mindfulness-type-cs,0.1.0,draft,,MindfulnessTypeCS,Mindfulness Practice Types,"Types of mindfulness practices and techniques","ValueSet/mindfulness-type-vs"
https://github.com/RicardoLSantos/shorthand/CodeSystem/nutrition-data-source-cs,0.1.0,draft,,NutritionDataSourceCS,Nutrition Data Source Code System,"Code system for nutrition data sources","ValueSet/nutrition-data-source-vs"
