URL,Version,Status,OIDs,Name,Title,Description,Used
http://example.org/CodeSystem/mindfulness-setting,0.1.0,active,,MindfulnessSettingCS,Mindfulness Setting CodeSystem,"",
https://github.com/RicardoLSantos/shorthand/CodeSystem/environment-type-cs,0.1.0,draft,,EnvironmentTypeCS,Practice Environment Types,"Types of environments for mindfulness practice",
https://github.com/RicardoLSantos/shorthand/CodeSystem/mindfulness-outcome-cs,0.1.0,draft,,MindfulnessOutcomeCS,Mindfulness Outcomes,"Outcomes and effects of mindfulness practice",
https://github.com/RicardoLSantos/shorthand/CodeSystem/mindfulness-qualifier-cs,0.1.0,draft,,MindfulnessQualifierCS,Mindfulness Practice Qualifiers,"Qualifiers for mindfulness practice characteristics",
https://github.com/RicardoLSantos/shorthand/CodeSystem/mindfulness-type-cs,0.1.0,draft,,MindfulnessTypeCS,Mindfulness Practice Types,"Types of mindfulness practices and techniques",
https://github.com/RicardoLSantos/shorthand/CodeSystem/nutrition-data-source-cs,0.1.0,draft,,NutritionDataSourceCS,Nutrition Data Source Code System,"Code system for nutrition data sources",
